{
  "active_authority": {
    "basis": [
      {
        "id": "tpc-di-1.1.0-4.5.8.1",
        "kind": "tpc_di_rule",
        "locator": "Clause 4.5.8.1 historical Trade and TradeHistory identity join",
        "source": "https://www.tpc.org/tpc_documents_current_versions/pdf/tpc-di_v1.1.0.pdf"
      },
      {
        "id": "tpc-di-1.1.0-4.5.8.2-create-close",
        "kind": "tpc_di_rule",
        "locator": "Clause 4.5.8.2 status-qualified creation and close timestamps",
        "source": "https://www.tpc.org/tpc_documents_current_versions/pdf/tpc-di_v1.1.0.pdf"
      },
      {
        "id": "issue-4-candidate-edge-adjudication",
        "kind": "approved_decision",
        "locator": "Decision",
        "source": ".oh/metis/issue-4-candidate-edge-adjudication.md"
      }
    ],
    "hat": "data-product-owner",
    "scope": "historical Trade and TradeHistory lifecycle handoff"
  },
  "allowed_artifacts": [
    "sketch.edge.trade_history_to_dim_trade"
  ],
  "authority_id": "repair.trade-lifecycle-edge.v1",
  "conflict_behavior": {
    "authority_conflict": "stop_and_adjudicate_under_domain_reviewer_hat",
    "projection_edit": "reject_and_regenerate_from_governing_sketch",
    "raw_or_schema_inference": "reject_as_non_authority"
  },
  "forbidden_adjacent_policy": [
    "sketch.stage.trade",
    "sketch.stage.trade_history",
    "sketch.stage.dim_trade_consumer",
    "sqlmesh.model.dim_trade",
    "sqlglot.ast.dim_trade",
    "generated_sql.dim_trade",
    "duckdb.dim_trade",
    "metric.trade_lifecycle_seconds"
  ],
  "schema_version": "repair-authority/v1"
}
