{
  "active_authority": {
    "basis": [
      {
        "id": "issue-8-incremental-key-binding-adjudication",
        "kind": "approved_decision",
        "locator": "Decision",
        "source": ".oh/metis/issue-8-incremental-key-binding-adjudication.md"
      },
      {
        "id": "ce-account-428-rollover-v1",
        "kind": "approved_counterexample",
        "locator": "general_rule",
        "source": "counterexamples/archive/ce-account-428-rollover-v1.json"
      }
    ],
    "hat": "data-product-owner",
    "scope": "incremental Trade CDC to DimTrade key binding and mutable update surface"
  },
  "allowed_artifacts": [
    "sketch.edge.trade_cdc_to_dim_trade_incremental"
  ],
  "authority_id": "repair.dim-trade-incremental-edge.v1",
  "conflict_behavior": {
    "authority_conflict": "stop_and_adjudicate_under_domain_reviewer_hat",
    "projection_edit": "reject_and_regenerate_from_governing_sketch",
    "raw_or_schema_inference": "reject_as_non_authority"
  },
  "forbidden_adjacent_policy": [
    "sketch.stage.trade_cdc",
    "sketch.stage.dim_account",
    "sketch.edge.trade_history_to_dim_trade",
    "sketch.stage.dim_trade_consumer",
    "sqlmesh.model.dim_trade_incremental",
    "sqlglot.ast.dim_trade_incremental",
    "generated_sql.dim_trade_incremental",
    "duckdb.dim_trade_incremental",
    "materialization.governed_merge",
    "metric.position_by_account",
    "metric.position_by_customer"
  ],
  "schema_version": "repair-authority/v1"
}
